{
  "description": "A public key whose y coordinate is one past the field prime does not verify TEST 1's signature.",
  "kind": "ed25519",
  "publicKey": "eeffffffffffffffffffffffffffffffffffffffffffffffffffffffffffff7f",
  "message": "",
  "signature": "e5564300c360ac729086e2cc806e828a84877f1eb8e5d974d873e065224901555fb8821590a33bacc61e39701cf9b46bd25bf5f0595bbe24655141438e7a100b",
  "expect": {
    "ok": false
  }
}
