{
  "description": "A manifest with BOTH an unknown kid and a bogus alg reports kid-unknown.",
  "kind": "verify",
  "manifest": {
    "id": "com.acme.calendar",
    "name": "Acme Calendar",
    "publisher": {
      "id": "acme"
    },
    "version": "1.4.0",
    "signature": {
      "protected": "eyJhbGciOiJFUzI1NiIsImtpZCI6IkZ0SXUtVmJHcmZlX0tCNkNIN0dOd09EQjcyTU54al9tbDExZEV2Ty03a2sifQ",
      "signature": "sxnBMqzXGTg_9YZlCo9Fhjrm6-lyuOZZBdg0O0MVgUGnINkN8bpPEMiVyC-lnxnbeW3CeUyPe1-6DKDNrB1bAQ"
    }
  },
  "trustedKeys": [
    {
      "kty": "OKP",
      "crv": "Ed25519",
      "x": "11qYAYKxCrfVS_7TyWQHOg7hcvPapiMlrwIaaPcHURo"
    }
  ],
  "expect": {
    "rejected": "kid-unknown"
  }
}
