{
  "description": "A private JWK thumbprints as its own public half; `d` is projected away.",
  "kind": "thumbprint",
  "jwk": {
    "kty": "OKP",
    "crv": "Ed25519",
    "x": "11qYAYKxCrfVS_7TyWQHOg7hcvPapiMlrwIaaPcHURo",
    "d": "nWGxne_9WmC6hEr0kuwsxERJxWl7MmkZcDusAxyuf2A"
  },
  "expect": {
    "ok": "kPrK_qmxVWaYVA9wwBF6Iuo3vVzz7TxHCTwXBygrS4k"
  }
}
