{
  "description": "A manifest signed by a key in the resolved set verifies.",
  "kind": "verify",
  "manifest": {
    "id": "com.acme.calendar",
    "name": "Acme Calendar",
    "publisher": {
      "id": "acme"
    },
    "version": "1.4.0",
    "signature": {
      "protected": "eyJhbGciOiJFZERTQSIsImtpZCI6ImtQcktfcW14VldhWVZBOXd3QkY2SXVvM3ZWeno3VHhIQ1R3WEJ5Z3JTNGsifQ",
      "signature": "sxnBMqzXGTg_9YZlCo9Fhjrm6-lyuOZZBdg0O0MVgUGnINkN8bpPEMiVyC-lnxnbeW3CeUyPe1-6DKDNrB1bAQ"
    }
  },
  "trustedKeys": [
    {
      "kty": "OKP",
      "crv": "Ed25519",
      "x": "11qYAYKxCrfVS_7TyWQHOg7hcvPapiMlrwIaaPcHURo"
    }
  ],
  "expect": {
    "ok": true
  }
}
