{
  "description": "Signing with RFC 8032 §7.1 TEST 2's seed produces the pinned protected header and signature.",
  "kind": "sign",
  "manifest": {
    "id": "com.acme.mail",
    "publisher": {
      "id": "acme"
    },
    "tools": [
      {
        "name": "search"
      },
      {
        "name": "send"
      }
    ],
    "limits": {
      "maxItems": 100,
      "offset": -1
    }
  },
  "privateKey": {
    "kty": "OKP",
    "crv": "Ed25519",
    "x": "PUAXw-hDiVqStwqnTRt-vJyYLM8uxJaMwM1V8Sr0Zgw",
    "d": "TM0Imyj_ltqdtsNG7BFOD1uKMZ81q6Yk2oz27U-4pvs"
  },
  "expect": {
    "ok": {
      "protected": "eyJhbGciOiJFZERTQSIsImtpZCI6IkZ0SXUtVmJHcmZlX0tCNkNIN0dOd09EQjcyTU54al9tbDExZEV2Ty03a2sifQ",
      "signature": "-2JAr3pgW3w1dBf5RDFGz9mmJNhpHcTSKJOkrdC48pZ4W3Vt9fSeaBY6xukMd6VeMkiINc24B_Pn5DFE_uhNAg"
    }
  }
}
